pergunta,resposta_esperada,resposta_modelo_treinado,resposta_modelo_base,rougeL_base,bleu_base,equal_base,rougeL_ft,bleu_ft,equal_ft
What happens during the metabolism of Reslizumab?,"Like other monoclonal antibodies, reslizumab is assumed to undergo enzymatic proteolysis into smaller peptides and amino acids. As reslizumab bind to the target, it is not expected to undergo a target-mediated clearance [FDA Label].",Reslizumab is expected to be degraded into small peptides and amino acids like other proteins.[L10097],"Reslizumab is a monoclonal antibody that binds to interleukin-5 (IL-5), a cytokine that is involved in the pathogenesis of asthma. IL-5 is produced by T helper cells and is a key mediator of eosinophilic inflammation. Reslizumab is a humanized IgG4 monoclonal antibody that binds to IL-5 with high affinity and specificity. Reslizumab is indicated for the treatment of severe asthma in patients aged 18 years and older. The recommended dose of reslizumab is 3 mg/kg administered subcutaneously every",0.15254237288135594,0.012568034099031143,0,0.3137254901960784,0.03344064697607619,0
What is the metabolism of Topotecan like?,Topotecan undergoes a reversible pH dependent hydrolysis of its lactone moiety; it is the lactone form that is pharmacologically active.,"Hepatic. Metabolized primarily via hydrolysis of the lactone ring, forming the active topotecan N-demethylated metabolite (CPT-11) and topotecan carboxylated metabolite (SN-38). CYP3A4 is responsible for the formation of SN-38.",The metabolism of Topotecan is mainly hepatic and involves CYP2C8 and CYP3A4. The drug is metabolized to,0.2162162162162162,0.017705765485586333,0,0.22641509433962265,0.031579834668896446,0
What is the absorption process of Equine Botulinum Neurotoxin G Immune FAB2?,Administration of one vial of containing at least 600 Units produced a mean Cmax of 0.59 Units/mL. Administration of two vials produced a mean Cmax of 1.19 Units/mL [FDA Label].,Administration of one vial of containing at least 3000 Units produced a mean Cmax of 2.97 Units/mL. Administration of two vials produced a mean Cmax of 5.94 Units/mL [FDA Label].,"The absorption process of Equine Botulinum Neurotoxin G Immune FAB2 is as follows:
1. The toxin is injected into the muscle of the horse.
2. The toxin is taken up by the muscle cells.
3. The toxin is transported to the nerve terminals.
4. The toxin blocks the release of acetylcholine from the nerve terminals.
5. The muscle is paralyzed.
6. The horse is unable to move the affected muscle.
7. The horse is unable to perform the task that requires the use of the affected muscle.
8. The horse is unable to perform the task that requires the use of",0.07407407407407407,0.005003934636883364,0,0.8529411764705882,0.7202343877500255,0
Can you explain how Cinolazepam is metabolized in the body?,Hepatic.,Hepatic.,Cinolazepam is metabolized in the body by the liver. The liver breaks down the drug into two main metabolites: 7-amino-cinolazepam and 7-hydroxy-cinolazepam. These metabolites are then excreted in the urine.,0.0,0.0,0,1.0,1.0,1
What is the metabolism of Brentuximab vedotin like?,Data in both animals and humans suggest that only a small fraction of MMAE released from brentuximab vedotin is metabolized. In vitro data indicate that the MMAE metabolism that occurs is primarily via oxidation by CYP3A4/5. In vitro studies using human liver microsomes indicate that MMAE inhibits CYP3A4/5 but not other CYP isoforms. MMAE did not induce any major CYP450 enzymes in primary cultures of human hepatocytes.[L39789],"The catabolism of brentuximab vedotin is not yet understood but it is thought to be degraded into small peptides, amino acids, unconjugated MMAE, and unconjugated MMAE-related catabolites. The unconjugated MMAE and MMAE-related catabolites are thought to be responsible for the resistance to MMAE-mediated cytotoxicity of the S33133 and CEM leukemia sublines selected from the parent S32 and CEM cell lines.[L8046,L8047]","Brentuximab vedotin is a monoclonal antibody that targets CD30, a protein found on the surface of some cancer cells. It is used in the treatment of Hodgkin's lymphoma and anaplastic large cell lymphoma. The metabolism of Brentuximab vedotin is complex and involves several steps. First, the drug is administered intravenously and binds to CD30 on the surface of cancer cells. This binding triggers the release of a cytotoxic agent, which is a small molecule that kills the cancer cells. The cytotoxic agent is then released into the bloodstream and travels to the cancer cells,",0.10909090909090909,0.01409637554856448,0,0.13333333333333333,0.027481802656390646,0
What happens during the absorption of NADH?,Unclear how much of an administered dose is absorbed.,Nicotinamide adenine dinucleotide (NAD+) is a coenzyme found in all living cells. NADH is the reduced form of NAD+ and is a cofactor in redox reactions. NADH is absorbed from the intestine following oral administration.,"During the absorption of NADH, the electrons are transferred from NADH to the electron transport chain. This process is called oxidative phosphorylation.",0.1290322580645161,0.014320472133097948,0,0.13636363636363638,0.009723975927788436,0
What is the metabolism process of Omalizumab?,"Monoclonal antibodies, in general, are believed to be internalized in endothelial cells bound to the Fc receptor and rescued from metabolism by recycling. At a later time, they are degraded in the reticuloendothelial system to smaller peptides and amino acids, which can then be used for de-novo protein synthesis [A31470]. Several factors may influence this process, however. These include factors related to the target antigen, antibody, and patient [A31470]. The metabolism of omalizumab is determined by its IgG1 framework, and by its specific binding to IgE. The elimination of omalizumab is dose-dependent. The reticuloendothelial system and the liver are two sites of elimination for IgG (including degradation in the liver reticuloendothelial system and endothelial cells) [F1946], [A31470]. The omalizumab:IgE complexes are thought to be to cleared via interactions with Fc- gamma-Rs (Fc gamma RI, Fc gamma RII, and Fc gamma RIII) at rates that are more rapid than that of IgG clearance. The relative clearance of free omalizumab, free IgE, and complexes is summarized as: free IgE clearance > > omalizumab:IgE clearance > omalizumab clearance [F1946].",Omalizumab is expected to be degraded into small peptides and amino acids via catabolic pathways in the same manner as endogenous IgG.[L14895],"Omalizumab is a recombinant humanized monoclonal antibody that binds to IgE and prevents it from binding to the high-affinity IgE receptor on mast cells and basophils. This prevents the release of mediators (such as histamine, sulfide leukotrienes, and prostaglandins) that play a role in allergic reactions. Omalizumab is used to treat moderate to severe persistent asthma in adults and children who are at least 6 years old. It is also used to treat moderate to severe persistent allergic asthma in children who are at least 6 years old and have a",0.14814814814814814,0.007014041304066937,0,0.09950248756218906,8.353596115710099e-05,0
How is Human cord blood hematopoietic progenitor cell absorbed?,Intravenous administration achieves complete bioavailability.,Intravenous infusion of cord blood hematopoietic progenitor cells is done in the same way as other blood products.,Human cord blood hematopoietic progen,0.0,0.0,0,0.08695652173913045,0.014238348381961592,0
What is the metabolism of Ciprofloxacin like?,"Ciprofloxacin is primarily metabolized by CYP1A2.[L6481] The primary metabolites oxociprofloxacin and sulociprofloxacin make up 3-8% of the total dose each.[L6487] Ciprofloxacin is also converted to the minor metabolites desethylene ciprofloxacin and formylciprofloxacin.[L6487] These 4 metabolites account for 15% of a total oral dose.[L6481] There is a lack of available data on the enzymes and types of reactions involved in forming these metabolites.[A178822,A178819,A178828,A178831]","Ciprofloxacin is primarily metabolized by CYP1A2.[L8623,L8626,L8637,L8634] The major metabolites are desethylene ciprofloxacin and formylciprofloxacin.[L8623,L8626,L8637,L8634]","Ciprofloxacin is a fluoroquinolone antibiotic that is used to treat a wide range of bacterial infections. It is a broad-spectrum antibiotic that is effective against both gram-positive and gram-negative bacteria. Ciprofloxacin is metabolized in the liver by the cytochrome P450 enzyme system, primarily by the CYP2C8 and CYP3A4 isoenzymes. The primary metabolite of ciprofloxacin is desethoxyciprofloxacin, which is also active against bacteria. The metabolism of ciprofloxacin is generally considered to be linear, meaning that",0.1891891891891892,0.025187836861053286,0,0.25806451612903225,0.012193807293458089,0
Tell me about Metyrapone's absorption mechanism.,Absorbed rapidly and well when administered orally. Peak plasma concentrations are usually reached 1 hour after administration.,Rapidly absorbed following oral administration.,Metyrapone is absorbed by the oral route.,0.16666666666666666,0.0,0,0.2727272727272727,0.00414124672834959,0
What happens during the absorption of Chloramphenicol succinate?,"Chloramphenicol succinate has a high degree of interpatient variability, with a T<sub>max</sub> of 18 minutes to 3 hours.[A192987] A 1g oral chloramphenicol succinate dose every 6-8 hours reaches a mean C<sub>max</sub> of 11.2µg/mL with a T<sub>max</sub> of 1 hour.[L14174]",Rapidly absorbed following oral administration. Bioavailability is 70-90% following oral administration.,Chloramphenicol succinate is absorbed by the body through the gastrointestinal tract. It is then metabolized by the,0.05633802816901408,0.009438748984624792,0,0.030303030303030304,0.001694111550392818,0
In what way is Bronopol metabolized?,"Bronopol undergoes degradation in aqueous medium to form bromonitroethanol from a retroaldol reaction with the liberation of an equimolar amount of formaldehyde [A32793]. Formaldehyde is a degradation product of bronopol, which may cause sensitization [L2578]. Bromonitroethanol further decomposes to formaldehyde and bromonitromethane. Bromonitroethanol may also break down to release a nitrite ion and 2-bromoethanol [A32793].","Bronopol undergoes hydrolysis in aqueous solutions to form 2-bromo-3-hydroxypropionaldehyde and 2-bromo-3-hydroxypropionic acid [L2578]. The aldehyde may react with water to form 2-bromo-3-hydroxypropionalcohol or react with itself to form 2,3-dibromo-1,4-butanedione [L2578]. The bromoalcohol may be dehydrogenated to form the bromoaldehyde [L2578].",Bronopol is metabolized by the liver.,0.06451612903225806,1.4049268228233235e-05,0,0.19999999999999998,0.023220103166092305,0
Tell me about Irbesartan's absorption mechanism.,"Irbesartan is 60-80% bioavailable with a T<sub>max</sub> of 1.5-2hours.[L7456,L7459] Taking irbesartan with food does not affect the bioavailability.[L7456,L7459] In one study, healthy subjects were given single or multiple oral doses of 150mg, 300mg, 600mg, and 900mg of irbesartan.[A181165] A single 150mg dose resulted in an AUC of 9.7±3.0µg\•hr/mL, a T<sub>max</sub> of 1.5 hours, a half life of 16±7 hours, and a C<sub>max</sub> of 1.9±0.4µg/mL.[A181165] A single 300mg dose resulted in an AUC of 20.0±5.2µg\•hr/mL, a T<sub>max</sub> of 1.5 hours, a half life of 14±7 hours, and a C<sub>max</sub> of 2.9±0.9µg/mL.[A181165] A single 600mg dose resulted in an AUC of 32.6±11.9µg\•hr/mL, a T<sub>max</sub> of 1.5 hours, a half life of 14±8 hours, and a C<sub>max</sub> of 4.9±1.2µg/mL.[A181165] A single 900mg dose resulted in an AUC of 44.8±20.0µg\•hr/mL, a T<sub>max</sub> of 1.5 hours, a half life of 17±7 hours, and a C<sub>max</sub> of 5.3±1.9µg/mL.[A181165] Multiple 150mg doses resulted in an AUC of 9.3±3.0µg\•hr/mL, a T<sub>max</sub> of 1.5 hours, a half life of 11±4 hours, and a C<sub>max</sub> of 2.04±0.4µg/mL.[A181165] Multiple 300mg doses resulted in an AUC of 19.8±5.8µg\•hr/mL, a T<sub>max</sub> of 2.0 hours, a half life of 11±5 hours, and a C<sub>max</sub> of 3.3±0.8µg/mL.[A181165] Multiple 600mg doses resulted in an AUC of 31.9±9.7µg\•hr/mL, a T<sub>max</sub> of 1.5 hours, a half life of 15±7 hours, and a C<sub>max</sub> of 4.4±0.7µg/mL.[A181165] Multiple 900mg doses resulted in an AUC of 34.2±9.3µg\•hr/mL, a T<sub>max</sub> of 1.8 hours, a half life of 14±6 hours, and a C<sub>max</sub> of 5.6±2.1µg/mL.[A181165]",Irbesaran is 60-80% bioavailable with a T<sub>max</sub> of 1.5-2 hours.[L7912] A high fat meal increases T<sub>max</sub> to 2.5-5 hours and increases bioavailability to 80-110%.[L7912],"Irbesartan is rapidly absorbed after oral administration with a bioavailability of about 60%. The absorption of Irbesartan is not affected by food. Irbesartan is excreted in the urine as unchanged drug, approximately 2% of the dose is excreted unchanged in the urine and approximately 60% of the dose is excreted in the urine as metabolites of Irbesartan.",0.08085106382978724,0.000919211928845943,0,0.11086474501108648,2.9737777262031267e-05,0
Describe the metabolic pathway of Filgotinib.,"Carboxylesterase enzymes are involved in the metabolism of filgotinib.[A221331] The carboxylesterase 2 (CES2) isoform is chiefly responsible for metabolizing filgotinib to its major metabolite, GS-829845.[A221331,A221336] Although carboxylesterase 1 (CES1) plays a less prominent role in the biotransformation of filgotinib, in vitro studies have demonstrated that CES1 will partially compensate in the event of CES2 saturation.[A221331] GS-829845 is thus far the only major circulating metabolite to have been identified.[L16616]","Filgotinib is metabolized by the CYP3A4 enzyme to its major metabolite, GS-829845.[L10202] GS-829845 is a pharmacologically active metabolite that binds to the same target as filgotinib, but with 30% less activity. It is also a substrate of CYP3A4.[L10202]",Filgotinib is a JAK inhibitor. It inhibits the JAK1 and JAK2 enzymes. It is used to treat rheumatoid arthritis. Filgotinib is a small molecule that binds to the JAK1 and JAK2 enzymes. It inhibits the JAK1 and JAK2 enzymes. It is used to treat rheumatoid arthritis. Filgotinib is a small molecule that binds to the JAK1 and JAK2 enzymes. It inhibits the JAK1 and JAK2 enzymes. It is used to treat rheumatoid arthritis. Filgotinib is a small,0.14473684210526316,0.007494297865453365,0,0.2393162393162393,0.04186484246297486,0
In what way is Colesevelam metabolized?,Not applicable (not hydrolyzed by digestive enzymes and not absorbed).,Not metabolized. Not hydrolyzed by digestive enzymes. Not absorbed.,Colesevelam is a,0.0,0.0,0,0.8421052631578948,0.13894429504872424,0
What is the absorption process of Chlorpheniramine?,Well absorbed in the gastrointestinal tract.,Readily absorbed following oral administration.,"The absorption process of Chlorpheniramine is the process of the drug being absorbed into the bloodstream. This process is important because it allows the drug to reach its target site and produce its desired effect. The absorption process of Chlorpheniramine is a complex process that involves several steps. First, the drug must be taken orally or intravenously. Once the drug is in the bloodstream, it is transported to the liver, where it is metabolized. The metabolites are then excreted in the urine. The absorption process of Chlorpheniramine is important because it allows the drug to reach its target site and produce its desired effect",0.05454545454545455,0.007358497896451685,0,0.1818181818181818,0.037374807627842434,0
How does the body absorb Methscopolamine bromide?,"Poorly and unreliably absorbed, total absorption is 10-25%.",Scopolamine is well absorbed from the gastrointestinal tract.,"The body absorbs Methscopolamine bromide by the mouth, nose, and eyes.",0.09999999999999999,0.021598265052211615,0,0.11764705882352941,0.028599617161713803,0
Describe the absorption characteristics of Silver.,"Although metallic silver is inert in the presence of human tissues, silver and its compounds may dissociate upon contact with skin surface, body fluids, and secretions, allowing the silver ions to be absorbed into the blood circulation [A33138]. Soluble silver salts are absorbed from the respiratory and gastrointestinal tracts. However, up to 90-99% of orally ingested silver is not absorbed and percutaneous absorption of silver ions through intact or damaged skin is also reported to be low [A33138]. Absorbed silver ions are deposited into elastic and connective tissues throughout the body [L2853]. Biologically active silver ions mainly binds to intracellular proteins as inert complexes, and readily binds and precipitates with inorganic cations like chloride and phosphate, which explains low absorption [A33138].",No pharmacokinetic data available.,"Silver is a soft, white, lustrous transition metal, with an atomic mass of 107.8682 amu. It is a good conductor of electricity, and is used in many electrical applications. Silver is also used in jewelry, and in the production of mirrors. Silver is a very rare element, and is found in only a few places on Earth. It is also used in the production of photographic film, and in the production of some medical devices. Silver is a very reactive element, and is easily oxidized. It is also a very good conductor of heat, and is used in the production of some electrical devices.",0.15859030837004404,0.011788656447003923,0,0.0,0.0,0
Describe the absorption characteristics of Plantago seed.,"Psyllium husk is capable of hydration and swelling to form a mucilage because it is only partially solubilized [L1865]. The polysaccharide dietary fibres of which psyllium husk is comprised of need to be hydrolyzed to monosaccharides before intestinal absorption can occur [L1865]. The sugar residues of the xylan backbone and side chains are joined by beta-linkages however, which cannot be broken by human digestive enzymes [L1865]. Less than 10% of the mucilage gets hydrolyzed in the stomach, with formation of free arabinose [L1865]. Intestinal absorption of the free arabinose is about 85% to 93% [L1865]. As a consequence, psyllium remains predominantly in the gastrointestinal tract as a 'bulk' agent that passes largely unchanged throughout the gut [L1872]. The agent has remarkable water holding capacity because of its high hemicellulose content [L1872].","Psyllium husk is a bulk-forming laxative that absorbs water in the intestine. When it is taken with adequate amounts of water, it produces a bulkier, softer stool that is easier to pass [A33056]. In a study of healthy volunteers, psyllium was found to have a low and variable absorption of 0.6% to 4.2% [A33056].",Plantago seed is a type of seed that is used in the production of plant-based foods. It is a type of seed that is used in the production of plant-based foods. It is a type of seed that is used in the production of plant-based foods. It is a type of seed that is used in the production of plant-based foods. It is a type of seed that is used in the production of plant-based foods. It is a type of seed that is used in the production of plant-based foods. It is a type of seed that is used in the production of plant-based foods. It is a type of seed that,0.1904761904761905,0.01163940397705827,0,0.14814814814814814,0.011913997000365014,0
What happens during the metabolism of Prezatide copper?,Prezatide is broken down to histidyl-lysine which is likely further degraded to other metabolites of proteolysis [A19502].,Prezatide is degraded by lysosomes and metalloproteases.[A228075],Prezatide copper is metabolized by the liver. The liver breaks down the drug into smaller molecules that are then excreted in the urine.,0.14634146341463414,0.015271699436865032,0,0.23076923076923078,0.02173169976539363,0
What happens during the absorption of Clobetasone?,"Absorption is dependent on many drug-related factors including: intrinsic properties of the steroid itself; concentration of the drug (increased concentration generally leads to more drug being absorbed but may plateau at higher concentrations); vehicle used (optimized or augmented vehicles > ointments or gels > creams or lotions); duration of exposure; frequency of application; combination with other products that break down the skin barrier and increase absorption (e.g., salicylic acid, urea). Patient-related factors that influence absorption include: patient age (infants and children absorb topical medications more quickly and to a greater degree than adults, and have a greater total skin surface to body weight ratio; the elderly have thinner skin and absorb drug more readily); disruption of the skin due to inflammation or disease (e.g., absorption increased in atopic dermatitis); total skin area treated; skin site treated (absorption is much greater from thin-skinned areas such as scalp, face, eyelid, axilla, and scrotum than from areas with thicker skin such as forearm, knee, elbow, palm and sole); absorption is increased with increased temperature or humidity of the skin or the environment; occlusion of the treated skin (via plastic wrap, oily vehicles, dressings, tape, diapers, tight-fitting clothing, etc.) can increase absorption up to 10-fold.",Topical corticosteroids can be absorbed from normal intact skin. Inflammation and/or other disease processes in the skin increase percutaneous absorption.,Clobetasone is absorbed by the skin and enters the bloodstream. It is,0.06422018348623854,1.1222441469122754e-08,0,0.09691629955947137,5.0677281583351215e-06,0
In what way is Polyethylene glycol 300 absorbed?,"PEGs can be absorbed by the gastrointestinal tract following oral administration with the fraction absorbed being dependent on the molecular weight of the compound [A33116]. It is likely to display minimal absorption through the intact skin, but may penetrate through injured skin with compromised barrier function [A33116].",PEGs are not absorbed or metabolized and they are excreted unchanged [L1790].,Polyethylene glycol 300 is absorbed by the small intestine.,0.10714285714285714,0.0022772349975443747,0,0.06779661016949153,0.0012899450545376613,0
What happens during the metabolism of Berotralstat?,"Berotralstat is metabolized by CYP2D6 and CYP3A4. The metabolic pathway and the metabolites of berotralstat have not yet been characterized. Following a single oral dose administration of 300 mg radiolabeled berotralstat, about 34% of the total plasma radioactivity accounted for the unchanged drug while about eight detectable metabolites accounted for 1.8 to 7.8% of the total radioactivity.[L26661]",Berotralstat is metabolized by CYP3A4 and CYP2D6.[L38995] The metabolites of berotralstat have not been characterized.,Berotralstat is a drug,0.125,3.5215230194168207e-07,0,0.3684210526315789,0.028406689680269527,0
Tell me about Golodirsen's metabolism mechanism.,Golodirsen is not extensively metabolized. There were no metabolites detected in plasma or urine during a pharmacokinetic study.[L10758],"Golodirsen is not extensively metabolized in the liver. The most abundant metabolite, N-acetyl golodirsen, accounts for approximately 20% of the total plasma exposure. The N-acetyl metabolite is inactive against dystrophin exon 51. No other metabolites have been detected in plasma.[L40067]","Golodirsen's metabolism mechanism is a process that involves the breakdown of Golodirsen into smaller molecules, which are then used by the body for energy production. This process is essential for the proper functioning of the body and is regulated by a variety of enzymes and hormones. The metabolism of Golodirsen is a complex process that involves several steps, including the absorption of Golodirsen from the digestive tract, its transport to the liver, and its breakdown into smaller molecules. The breakdown of Golodirsen is carried out by a variety of enzymes, including those that are involved in the metabolism of carbohydrates, proteins,",0.06611570247933884,0.008119950114357009,0,0.3225806451612903,0.07349664483463557,0
Tell me about Simoctocog alfa's absorption mechanism.,"At initial assessment following administration of 50 IU/kg simoctocog alfa in adolescent or adult patients with severe haemophilia A, the mean ± SD AUC (FVIII:C) was 17.95 ± 5.57 h·IU/mL/(IU/kg) [L1115]. The mean ± SD maximum plasma concentration divided by the dose (Cmaxnorm) was 0.022 ± 0.003 IU/mL/(IU/kg) [L1115]. The values of mean ± SD AUC (FVIII:C) and Cmaxnorm in pediatric patients were 10.92 ± 3.80 h·IU/mL/(IU/kg) and 0.017 ± 0.003 IU/mL/(IU/kg), respectively [L1115]. At 6-month assessment in adolescent or adult patients with the same dose, the mean ± SD AUC (FVIII:C) and Cmaxnorm were 16.86 ± 6.12 h·IU/mL/(IU/kg) and 0.021 ± 0.003 IU/mL/(IU/kg), respectively [L1115].","Following intravenous administration of 50 IU/kg, the mean peak plasma concentration (Cmax) was 112 IU/dL. The mean area under the factor VIII activity time curve (AUC) was 1680 IUxh/dL. The mean area under the factor VIII antigen time curve (AUC) was 1680 IUxh/dL [FDA Label].","Simoctocog alfa is a recombinant factor IXa (rFIX) protein that is used to treat hemophilia B. It is a recombinant protein that is produced in a mammalian cell line. The protein is then purified and formulated into a sterile, preservative-free solution for intravenous administration. The absorption mechanism of simoctocog alfa is through the intravenous route. The protein is absorbed into the bloodstream and distributed throughout the body. It is then metabolized by the liver and excreted in the urine. The half-life of simoctocog alfa is approximately 18 hours.",0.11607142857142858,0.012610348562355218,0,0.19672131147540983,0.013703937752450936,0
