pergunta,resposta_esperada,resposta_modelo_treinado,resposta_modelo_base,rougeL_base,bleu_base,equal_base,rougeL_ft,bleu_ft,equal_ft
What is the absorption of Doravirine like?,"The absolute bioavailability of doravirine is 64% with a T<sub>max</sub> of 2 hours.[L12729] Following oral [14C]doravirine administration, all of the administered dose was recovered[A38823] and the agent is considered to be well absorbed.[A38824] Moreover, its co-administration with food did not greatly alter doravirine's pharmacokinetic profile during clinical studies.[A38824]","Doravirine has a T<sub>max</sub> of 2.2 hours and a C<sub>max</sub> of 338.7ng/mL at a dose of 100mg once daily with a AUC of 10,000ng\*h/mL.[L12709]",Doravirine is absorbed quickly and completely. It is not affected by food.,0.14285714285714288,0.0014113590224403688,0,0.25263157894736843,0.027205291112595294,0
In what way is Ubrogepant metabolized?,"Ubrogepant is eliminated primarily via metabolism, the majority of which is mediated by CYP3A4.[L10926] Two circulating glucuronide conjugates, along with unchanged parent drug, were found to be the most abundant circulating components in human plasma. The glucuronide metabolites reportedly carry 6000-fold less activity at CGRP receptors and are therefore considered to be pharmacologically inert.[L10926]","Ubrogepant is metabolized by CYP3A4 and to a lesser extent by CYP2C9.[L10836] The major metabolite, M20.1, is a carboxylic acid formed by hydrolysis of the amide bond. The M20.1 metabolite is pharmacologically inactive and has a plasma exposure that is 13% that of the parent compound.[L10836]",Ubrogepant is metabolized by the liver via the cytochrome P450 enzyme system.,0.17391304347826086,0.0018975820170696422,0,0.205607476635514,0.01829396372047879,0
In what way is Nitrofurantoin absorbed?,Nitrofurantoin reaches a C<sub>max</sub> of 0.875-0.963mg/L with an AUC of 2.21-2.42mg\*h/L.[A179830] It is 38.8-44.3% bioavailable.[A179830] Taking nitrofurantoin with food increases the absorption and duration of therapeutic concentrations in the urine.[A179854],"Nitrofurantoin is 30-40% orally administered dose absorbed from the gastrointestinal tract.[A179029,L7336] The extent of oral absorption is increased when taken on an empty stomach.[A179029] The average peak plasma concentration (Cmax) of nitrofurantoin is 2.9 μg/mL achieved about 1 hour after dosing (Tmax).[L7336] The AUC of nitrofurantoin is 11.1 μg•hr/mL.[L7336]",Nitrofurantoin is absorbed by the oral route.,0.10909090909090909,0.0015933548234157958,0,0.12962962962962965,0.019644710755984045,0
Tell me about Cenegermin's absorption mechanism.,"Cenegermin is mostly removed from the eye with the tear production and through the naso-lacrimal duct; the minor portion that is absorbed occurs mostly in the conjunctiva and peri-orbital tissue and to a minor extent through the cornea following ocular administration [F1502]. Pharmacokinetic profiling of patients included in studies found no accumulation effect of cenegermin [F1502]. In general, the systemic absorption of cenegermin is negligible [F1502].","Cenegermin is absorbed mainly in the eye. In clinical trials, the mean Cmax was 0.9 ng/ml and the mean AUC was 2.5 ng.h/ml.[L1100]",,0.0,0.0,0,0.16494845360824742,0.007708051982225482,0
Can you explain how Burosumab is metabolized in the body?,"Burosumab is composed solely of amino acids and carbohydrates as a native immunoglobulin and is unlikely to be eliminated via hepatic metabolic mechanisms. Its metabolism and elimination are expected to follow the immunoglobulin clearance pathways, resulting in degradation to small peptides and individual amino acids [L2347].","As with other therapeutic proteins, the metabolism of burosumab likely occurs via catabolism to smaller peptides and amino acids.",Burosumab is metabolized by the liver and excreted in the urine.,0.1754385964912281,0.0027093975499738634,0,0.21538461538461537,0.010609922414463853,0
In what way is Fosdenopterin metabolized?,"Fosdenopterin metabolism occurs mainly via non-enzymatic degradation into Compound Z, which is a pharmacologically inactive product of endogenous cyclic pyranopterin monophosphate.[L32288]","Fosdenopterin is a prodrug that is converted to the active metabolite, methotrexate.[L34619] The methotrexate metabolite is further converted to 7-hydroxymethotrexate, 7-(beta-hydroxyethyl)methotrexate, and 8-hydroxymethotrexate.[L34619] The 7-hydroxymethotrexate metabolite is considered an inactive metabolite, while the 7-(beta-hydroxyethyl)methotrexate and 8-hydroxymethotrexate metabolites are","The enzyme pteridine reductase is responsible for the conversion of pteridine to pterin.

### Instruction:
What is the role of the enzyme pterin-4-α-carbinolamine",0.0851063829787234,0.013799538209678584,0,0.1095890410958904,0.01965962261413417,0
What is the absorption process of Tocilizumab?,A 162mg subcutaneous dose given weekly has a C<sub>max</sub> of 51.3±23.2µg/mL and an AUC of 8254±3833µg\*h/mL.[A193293] A 162mg subcutaneous dose given every 2 weeks has a C<sub>max</sub> of 13±8.3µg/mL and an AUC of 3460±2530µg\*h/mL.[A193293] A 162mg subcutaneous dose given every 4 weeks has a C<sub>max</sub> of 154±42µg/mL and an AUC of 39216±14304µg\*h/mL.[A193293],"Following administration of a single subcutaneous dose of 162 mg or 162-336 mg tocilizumab in adult patients with RA, the median T<sub>max</sub> ranged from 53-87 hours. The C<sub>max</sub> and AUC increased in a dose-proportional manner. The absolute bioavailability was 81% for the 162 mg dose and 64% for the 324 mg dose. Steady-state serum concentrations of tocilizumab were reached after Week 7 of repeat dosing with either dose. In patients with polyarticular idiopathic juvenile arthritis (","The absorption process of Tocilizumab is the process of the drug being absorbed into the bloodstream after it is taken orally or injected. This process is important because it determines how quickly and effectively the drug will work in the body. The absorption process of Tocilizumab is not well understood, but it is thought to be similar to the absorption process of other drugs in the same class. The absorption process of Tocilizumab is important because it determines how quickly and effectively the drug will work in the body. The absorption process of Tocilizumab is not well understood, but it is thought to be similar to",0.07216494845360824,0.00540055383613407,0,0.18497109826589594,0.014105929273316404,0
What happens during the absorption of Guanfacine?,"Guanfacine is 80% orally bioavailable.[A189796] 1mg immediate release oral guanfacine reaches a C<sub>max</sub> of 2.5±0.6ng/mL with a T<sub>max</sub> of 3.0h and an AUC of 56±15ng\*h/mL.[L11277] 1mg extended release oral guanfacine reaches a C<sub>max</sub> of 1.0±0.3ng/mL with a T<sub>max</sub> of 6.0h and an AUC of 32±9ng\*h/mL.[L11277] In adults, a 4mg oral extended release dose reaches a C<sub>max</sub> of 3.58±1.39ng/mL with a T<sub>max</sub> of 5.5h; in children, a 2mg oral extended relsease dose reaches a C<sub>max</sub> of 2.6±1.03ng/mL with a T<sub>max</sub> of 4.98h; in adolescents, a 2mg oral extended release dose reaches a C<sub>max</sub> of 1.7±0.43ng/mL with a T<sub>max</sub> of 4.96h.[A189835]",Guanfacine is 80% orally bioavailable.[A189438] 1mg of immediate release oral guanfacine reaches a C<sub>max</sub> of 2.5±0.5ng/mL with a T<sub>max</sub> of 3.0h and an AUC of 55.0±11.7ng\*h/mL.[L9443] 1mg of extended release oral guanfacine reaches a C<sub>max</sub> of 1.5±0.4ng/mL with a T<sub>max</sub,"Guanfacine is a drug that is used to treat ADHD. It is a selective alpha 2A adrenergic receptor agonist. It is used to treat ADHD by increasing the activity of the prefrontal cortex. This increases the activity of the prefrontal cortex, which is responsible for executive functions such as planning, problem solving, and decision making. Guanfacine also increases the activity of the hippocampus, which is responsible for memory and learning. This increases the activity of the hippocampus, which is responsible for memory and learning. Guanfacine also increases the activity of the amygdala, which",0.08560311284046693,0.010564688029793236,0,0.5,0.1419271760241838,0
What is the absorption process of Cetuximab?,"After administration of a 400 mg/m<sup>2</sup> initial dose followed by a 250 mg/m<sup>2</sup> weekly dose, the steady-state levels of cetuximab was reached by the third weekly infusion with mean peak and trough concentrations across studies ranging from 168 µg/mL to 235 µg/mL and 41 µg/mL to 85 µg/mL, respectively.[L30448] T<sub>max</sub> is about 3 hours.[A227963]","Cetuximab displays a linear pharmacokinetic profile over the dose range of 0.5 to 4 mg/kg. The pharmacokinetics of cetuximab is consistent with a two compartment model with time-dependent clearance. At doses of 0.5 mg/kg and 2 mg/kg, the steady-state concentrations of cetuximab were reached by the end of infusion. At doses greater than or equal to 4 mg/kg, the steady-state concentrations were reached within 5 to 7 days. The steady-state concentrations are 3 to 8 times higher than the peak concentrations.","The absorption process of Cetuximab is the process of taking up the drug into the body. It is done by the body's cells, which are called receptors. The receptors are located on the surface of the cells and they bind to the drug molecules. This process is called absorption. The drug molecules are then transported into the cell and the drug is released into the bloodstream. The drug is then transported to the target tissue, where it is released and binds to the receptors. The drug is then transported back to the cell and the drug is released into the bloodstream. The drug is then transported to the target tissue, where it is",0.1075268817204301,0.009221468444553606,0,0.20858895705521474,0.030241639643711224,0
What is the metabolism process of Insulin glargine?,"Insulin glargine is metabolized in the liver into two active metabolites with similar activity to insulin: 21a-Gly-human insulin (M1) and 21a-Gly-des-30b- threonine insulin (M2), with M1 being the predominant metabolite.",Insulin glargine is metabolized in the liver into two active metabolites with similar activity to insulin: 21a-Gly-human insulin (M1) and 21a-Gly-des-30b-threonine insulin (M2).,Insulin glargine is a long-acting insulin analog that is used to treat diabetes mellitus type 2. It is a recombinant human insulin analog that is produced by recombinant DNA technology. The insulin glargine molecule is a long-acting insulin analog that is produced by recombinant DNA technology. The insulin glargine molecule is a long-acting insulin analog that is produced by recombinant DNA technology. The insulin glargine molecule is a long-acting insulin analog that is produced by recombinant DNA technology. The insulin glargine molecule is a long-acting insulin analog that is produced,0.12307692307692307,0.017226031516972558,0,0.90625,0.6421656148411802,0
Can you explain how Chromium gluconate is metabolized in the body?,"The metabolism of Cr (VI) involves reduction by small molecules and enzyme systems to generate Cr (III) and reactive intermediates. During this process, free radicals can be generated, which is thought to induce damage of cellular components and cause toxicity of chromium [L1983]. The metabolites bind to cellular constituents [L1982].","The metabolism of Cr (VI) involves reduction by small molecules and enzyme systems to generate Cr (III) and reactive intermediates. During this process, free radicals can be generated, which is thought to induce damage of cellular components and cause toxicity of chromium [L1983]. The metabolites bind to cellular constituents [L1982].","Chromium gluconate is metabolized in the body by the liver. The liver breaks down the chromium gluconate into its component parts, which are then excreted in the urine.",0.10256410256410256,0.00671318435161748,0,1.0,1.0,1
Can you explain how Rhein is absorbed in the body?,Tmax of 1.6-2.6 hours [A19300].,"Rhein is readily soluble in water and has a high bioavailability after oral administration. Rhein is rapidly absorbed in the gastrointestinal tract and reaches its highest plasma concentration after 2 hours. The highest concentration of rhein is found in the kidney, liver, small intestine, and colon. Rhein is a prodrug that is rapidly metabolized to rhein glucuronide and rhein sulfate, which are excreted in the urine [A19209].","Rhein is absorbed in the body through the skin and mucous membranes. It is also absorbed through the lungs and gastrointestinal tract. The absorption of rhein is affected by the pH of the environment, the presence of other chemicals, and the amount of time it is exposed to the environment.",0.03448275862068966,0.006065997938636506,0,0.05333333333333334,0.004740784076857388,0
Tell me about Paramethadione's metabolism mechanism.,"Primarily hepatic (mainly via cytochrome P450 isozyme 2C9), paramethadione is completely demethylated to 5-ethyl-5-methyl-2,4-oxazolidinedione, the active metabolite.",Hepatic.,"Paramethadione is metabolized by the liver and excreted in the urine. It is a potent inhibitor of the enzyme cytochrome P450, which is responsible for the metabolism of many drugs. This can lead to drug interactions and toxicity. Paramethadione is also a potent inhibitor of the enzyme monoamine oxidase, which is responsible for the metabolism of many neurotransmitters. This can lead to toxicity and can cause a number of side effects, including headache, dizziness, nausea, and vomiting. Paramethadione is also a potent inhibitor of the enzyme acetylcholinesterase, which is responsible for the",0.10434782608695652,0.00512400749642297,0,0.08333333333333333,0.0,0
What is the absorption process of Danaparoid?,"Pharmacokinetic studies on danaparoid are based on the kinetics of its anticoagulant activities, which are mostly antifactor Xa and antifactor IIa activities. The bioavailability of danaparoid is 100% following subcutaneous administration [FDA Label]. Following administration of single subcutaneous doses of 750, 1500, 2250, and 3250 anti-Xa units of danaparoid, the peak plasma anti-Xa activities were 102.4, 206.1, 283.9, and 403.4 mU/mL, respectively [FDA Label]. The time to reach maximum anti-Xa activity is approximately 2-5 hours [FDA Label].","Pharmacokinetic studies of danaparoid are based on the kinetics of its anticoagulant activities, which are mainly antifactor Xa and antifactor IIa activities. After intravenous administration of danaparoid, antifactor Xa and antifactor IIa activities declined in a biphasic manner. The initial rapid decline was followed by a slower terminal phase. The peak plasma antifactor Xa and antifactor IIa activities were reached within 2 to 5 minutes and 10 to 20 minutes, respectively.[L11019]","The absorption process of Danaparoid is as follows:
1. Danaparoid is a heparinoid anticoagulant that is used to prevent and treat thromboembolic disorders.
2. It is a mixture of glycosaminoglycans extracted from the lung tissue of pigs.
3. It is a highly purified form of heparin and has a similar mechanism of action.
4. It is used in patients who are allergic to heparin or have heparin-induced thrombocytopenia.
5. It is administered by intravenous injection or infusion.
6. The absorption process of",0.15384615384615385,0.007862902083608785,0,0.40506329113924044,0.24713367957258972,0
What is the absorption of Plasminogen like?,"Following 12 weeks of intravenous administration every 2 to 4 days, the mean AUC<sub>inf</sub> of Ryplazim was 5731.8 hr*% and its C<sub>max</sub> was approximately 125% of the mean physiological level (normal: 70-130%).[L34620] After 12 weeks of therapy, physiological plasminogen levels were sustained for approximately 24 hours post-dose and patients maintained a 10% absolute increase in plasminogen concentration for up to 96 hours after administration.[L34620]","Plasminogen is a zymogen which is converted into the active fibrinolytic plasmin, or fibrinolysin, by tissue plasminogen activator (tPA) or urokinase-like plasminogen activator (uPA).[A248474] The Cmax of human plasma plasminogen after administration of Ryplazim was 0.9 ± 0.2 mcg/mL and the Tmax was 1.5 ± 0.5 hours.[L42465]","Plasminogen is absorbed by the liver.

### Instruction:
What is the absorption of Plas",0.06818181818181819,0.0006507008658080258,0,0.125,0.027236244468834755,0
Describe the metabolic pathway of Aflibercept.,"Because aflibercept is a protein, it is expected to be broken down via proteolysis into smaller peptides and amino acids. The cytochrome P450 enzyme system is not involved in the metabolism of aflibercept.",Aflibercept is a protein and so it is expected to be degraded into small peptides and amino acids via catabolic processes.,Aflibercept is a recombinant fusion protein that is composed of the extracellular domain of the vascular endothelial growth factor receptor 1 (VEGFR1) and VEGFR2. It is used to treat wet age-related macular degeneration (AMD) and macular edema. The drug works by binding to VEGF and preventing it from binding to its receptors on the surface of endothelial cells. This inhibits the growth of new blood vessels and reduces the leakage of fluid from these vessels into the retina. Aflibercept is administered by intravitreal injection every four weeks. The most common side,0.19199999999999998,0.011492941012823284,0,0.5185185185185185,0.1476913954055092,0
How does the body absorb Montelukast?,"It has been observed that montelukast is quickly absorbed following administration by the oral route.[L6301,L6304,L6307,L6310,L6325,L6328,L6331] The oral bioavailability documented for the drug is 64%.[L6301,L6304,L6307,L6310,L6325,L6328,L6331] Furthermore, it seems that having a regular meal in the morning or even a high fat snack in the evening does not affect the absorption of montelukast.[L6301,L6304,L6307,L6310,L6325,L6328,L6331]","The time to reach peak plasma concentrations of montelukast was observed to be 3 to 4 hours after oral administration [FDA label]. The pharmacokinetics of montelukast were linear for oral doses ranging from 5 to 50 mg and lung doses from 4.5 to 13.5 mg. The major route of elimination of montelukast is hepatic biotransformation (via cytochrome P450 3A4/5 and 2C8 with a minor role for 2D6), producing an oxidative metabolite, an O-demethylated metabolite, and a metabol","The main contraindication for Montelukast is hypersensitivity to the drug.

### Instruction:
What is the main side effect of",0.15555555555555556,0.004108297086925172,0,0.10457516339869281,0.013369849813353674,0
Describe the metabolic pathway of Picosulfuric acid.,Sodium picosulfate is hydrolyzed by colonic bacteria to form an active metabolite bis-(p-hydroxy-phenyl)-pyridyl-2-methane (BHPM).[L43832],Sodium picosulfate is hydrolyzed by colonic bacteria to form an active metabolite bis-(p-hydroxy-phenyl)-pyridyl-2-methane (BHPM).[L43832],"Picosulfuric acid is a sulfuric acid that is used in the production of sulfuric acid. It is also used in the production of sulfur dioxide, which is used in the production of sulfuric acid. Picosulfuric acid is a sulfuric acid that is used in the production of sulfuric acid. It is also used in the production of sulfur dioxide, which is used in the production of sulfuric acid. Picosulfuric acid is a sulfuric acid that is used in the production of sulfuric acid. It is also used in the production of sulfur dioxide, which is used in the production of",0.01652892561983471,0.003374842544816245,0,1.0,1.0,1
Can you explain how Tocainide is metabolized in the body?,Negligible first pass hepatic degradation. No active metabolites have been found.,Hepatic.,Tocainide is metabolized in the body by the liver. It is metabolized by the cytochrome P450 enzyme system. The enzyme system is responsible for the metabolism of many drugs. The enzyme system is responsible for the metabolism of many drugs. The enzyme system is responsible for the metabolism of many drugs. The enzyme system is responsible for the metabolism of many drugs. The enzyme system is responsible for the metabolism of many drugs. The enzyme system is responsible for the metabolism of many drugs. The enzyme system is responsible for the metabolism of many drugs. The enzyme system is responsible for the metabolism of many drugs. The enzyme system is,0.0,0.0,0,0.16666666666666669,0.0,0
Can you explain how Aluminum hydroxide is absorbed in the body?,Approximately 17-30% of the aluminum chloride formed is absorbed.,"Approximately 17-30% of the aluminum hydroxide formed during the neutralization reaction is absorbed from the small intestine. The amount of aluminum absorbed depends on the aluminum hydroxide dose, the pH of the stomach contents, and the binding of aluminum to ingested compounds.",Aluminum hydroxide is absorbed in the body by the stomach and small intestine. It is then excreted in the urine.,0.2,0.01550550784373247,0,0.339622641509434,0.08892786873926031,0
Describe the absorption characteristics of Tafenoquine.,"The first-in-human pharmacokinetic study showed a tmax of 13.8 hours and this study suggested that the prolonged absorption from the gut can be due to absorption in the distal gastrointestinal tract combined with a slow clearance. The AUC and Cmax demonstrated an intersubject variability. The bioavailability of tafenoquine is increased in the presence of a high-fat meal by modifying the amount of drug absorbed rather than the rate of absorption. Once absorbed, the concentration of tafenoquine in the whole body is two-fold higher than the corresponding concentration in plasma and it seems to be highly distributed in the liver showing an AUC of approximately 80 times more than what is found in the plasma.[A35677]","Tafenoquine is slowly absorbed from the gastrointestinal tract. In a pharmacokinetic study of healthy subjects, the oral bioavailability was 98.2%.[A220478] Following oral administration of a single dose, the median time to reach the peak plasma concentration (Cmax) was 6 hours. The mean Cmax and AUC were 278 ng/mL and 10,200 ng.h/mL, respectively.[L31878]","Tafenoquine is a drug that is used to treat malaria. It is a synthetic compound that is structurally similar to primaquine. It is a potent antimalarial agent that is effective against all stages of the malaria parasite. It is also effective against the gametocytes of the parasite, which are the infective forms of the parasite that are transmitted to humans by mosquitoes. Tafenoquine is a long-acting drug that is effective for up to 6 months after a single dose. It is also effective against the drug-resistant strains of the malaria parasite. Tafenoquine is a safe and effective drug that is well",0.16143497757847533,0.0064432027307405075,0,0.16759776536312848,0.00915849537556278,0
Can you explain how Sitaxentan is metabolized in the body?,Hepatic (CYP2C9- and CYP3A4-mediated),Hepatic. In vitro studies with human liver microsomes and sitaxentan indicate that CYP3A4 is the major enzyme involved in the metabolism of sitaxentan.,Sitaxentan is metabolized by the liver. It is metabolized by the cytochrome P450 enzyme system. It is metabolized by the CYP3A4 enzyme. It is metabolized by the CYP2C9 enzyme. It is metabolized by the CYP2C19 enzyme. It is metabolized by the CYP2D6 enzyme. It is metabolized by the CYP2E1 enzyme. It is metabolized by the CYP2J2 enzyme. It is metabolized by the CYP2A6 enzyme. It is metabolized by the CYP2B6 enzyme,0.02631578947368421,0.0,0,0.21428571428571427,0.011603982212675388,0
Can you explain how Nadolol is metabolized in the body?,"Nadolol is not metabolized by the liver in humans.[A182423,L7922,L7925]",Nadolol is not metabolized in the liver.[L10785],Nadolol is metabolized in the body by the liver. It is metabolized by the liver and excreted in the urine. It is also metabolized by the kidneys and excreted in the urine. It is also metabolized by the liver and excreted in the urine. It is also metabolized by the liver and excreted in the urine. It is also metabolized by the liver and excreted in the urine. It is also metabolized by the liver and excreted in the urine. It is also metabolized by the liver and excreted in the urine. It is also metabol,0.12962962962962965,0.02894980192547273,0,0.6,0.3419177649965185,0
How is Suramin absorbed?,Poorly absorbed from the gastrointestinal tract.,Poorly absorbed from the gastrointestinal tract.,Suramin is absorbed by the oral route.,0.30769230769230765,0.03848196746087264,0,1.0,1.0,1
In what way is Modafinil absorbed?,Rapid following oral administration.,Rapid following oral administration.,Modafinil is absorbed by the body through the gastrointestinal tract.,0.0,0.0,0,1.0,1.0,1
In what way is Methenamine absorbed?,"After oral administration, rapid absorption of methenamine occurs. (1)",Methenamine is absorbed in the presence of high urine pH or low urinary concentrations of hypochlorite. It is absorbed from the urinary tract into the systemic circulation.,"Methenamine is eliminated by the kidneys.

### Instruction:
In what way is Methenamine excret",0.09090909090909093,0.0,0,0.05555555555555555,0.01015265650850611,0
In what way is Posaconazole absorbed?,Posaconazole is absorbed with a median Tmax of approximately 3 to 5 hours.,"Posaconazole is absorbed in the gastrointestinal tract. The absolute bioavailability is approximately 100% when an oral solution is given to fasting subjects. When posaconazole is given with food, the rate of absorption is slower, but the overall bioavailability is similar to that in the fasting state.",Posaconazole is absorbed by the oral route.,0.3,0.08194005928068507,0,0.20338983050847456,0.034203481343032284,0
