pergunta,resposta_esperada,resposta_modelo_treinado,resposta_modelo_base,rougeL_base,bleu_base,equal_base,rougeL_ft,bleu_ft,equal_ft
Tell me about Eptinezumab's metabolism mechanism.,Monoclonal antibody agents like eptinezumab are not expected to generate toxic metabolites as they generally undergo proteolysis to their constituent amino acids.[F94],Monoclonal antibodies are expected to be metabolized to smaller proteins and peptides by proteolytic enzymes.[A40006],"Eptinezumab is a monoclonal antibody that binds to the CGRP receptor and blocks the binding of CGRP to its receptor. This prevents the release of vasodilatory and pro-inflammatory mediators, including prostaglandins, leukotrienes, and cytokines, which are involved in the pathophysiology of migraine. Eptinezumab is administered as a subcutaneous injection and has a half-life of approximately 2 weeks.",0.0975609756097561,0.008124508692308446,0,0.30769230769230765,0.03050047663202996,0
What happens during the absorption of Isosorbide?,Isosorbide is rapidly absorbed after oral administration.[L34064] Refer to [isosorbide mononitrate] for detailed absorption information.,Isosorbide is rapidly absorbed from the gastrointestinal tract.,The absorption of Is,0.1,0.003901723237102224,0,0.3333333333333333,0.14411786453067818,0
What is the absorption process of Rofecoxib?,"The mean oral bioavailability of rofecoxib at therapeutically recommended doses of 12.5, 25, and 50 mg is approximately 93%.","Rofecoxib is rapidly absorbed following oral administration. The absolute bioavailability of rofecoxib is unknown. Peak plasma concentrations are attained 2 to 3 hours after dosing, and steady state is achieved within 5 to 6 days.",The absorption process of Rofecoxib is the process of the drug being absorbed into the body. The drug is taken orally and is absorbed through the stomach and small intestine. The drug is then transported to the liver where it is metabolized and excreted,0.18749999999999997,0.010097435863652391,0,0.2545454545454545,0.04461180754093855,0
What is the absorption of Levodopa like?,"Orally inhaled levodopa reaches a peak concentration in 0.5 hours with a bioavailability than is 70% that of the immediate release levodopa tablets with a peripheral dopa decarboxylase inhibitor like carbidopa or benserazide[Label,A177781].",Levodopa is rapidly absorbed from the gastrointestinal tract. The bioavailability of levodopa is 25-50%.[A229831] The Cmax of levodopa is 1.33-2.8 mg/L and is reached after 50-90 minutes.[A229831],"The absorption of Levodopa is like a roller coaster ride. It starts off slow and steady, but then it picks up speed and becomes more intense. The ride is thrilling and exciting, but it can also be a little bit scary.",0.1038961038961039,0.010712501202976362,0,0.14084507042253522,0.0127235300785,0
How does the body process Hexylresorcinol metabolically?,"Regarding the metabolism of hexylresorcinol, it has been reported that excretion of the compound in the urine is largely in the form of an ethereal sulfate conjugate [L2739].",No information regarding metabolism of hexylresorcinol is available.,Hexylresorcinol is metabolized by the body by conjugation with glucuronic acid.,0.2051282051282051,0.005476385151940432,0,0.2777777777777778,0.006470422614424571,0
What is the metabolism of Amiloxate like?,No pharmacokinetic data available.,No pharmacokinetic data available.,Amiloxate is a drug that is used to treat diabetes. It is a drug that is used to treat diabetes. It is a drug that is used to treat diabetes. It is a drug that is used to treat diabetes. It is a drug that is used to treat diabetes. It is a drug that is used to treat diabetes. It is a drug that is used to treat diabetes. It is a drug that is used to treat diabetes. It is a drug that is used to treat diabetes. It is a drug that is used to treat diabetes. It is a drug that is used to treat diabetes. It is a drug,0.0,0.0,0,1.0,1.0,1
How does the body process Betula pendula tar oil metabolically?,This pharmacokinetic property has not been studied.,"For local use only, no systemic absorption.","Betula pendula tar oil is metabolized by the body through the process of oxidation. This process involves the breaking down of the oil into smaller molecules, which are then used by the body for energy production. The oxidation process is carried out by enzymes in the liver, which convert the oil into smaller molecules that can be used by the body. The resulting molecules are then transported to the cells, where they are used for energy production. The oxidation process is an important part of the body's metabolism, as it allows the body to use the oil for energy production.",0.018518518518518517,0.003374842544816245,0,0.0,0.0,0
Describe the absorption characteristics of Remoxipride.,"Remoxipride is approximately 90% bioavailable.[A215502] In patients with normal creatinine clearance, remoxipride reaches a C<sub>max</sub> of 5.5 ± 1.1 µmol/L, with a T<sub>max</sub> of 0.8 ± 0.2 h, and an AUC of 39 ± 9 µmol\*h/L.[A215502] In patients with moderate renal impairment, remoxipride reaches a C<sub>max</sub> of 7.7 ± 2.7 µmol/L, with a T<sub>max</sub> of 0.9 ± 0.4 h, and an AUC of 63 ± 34 µmol\*h/L.[A215502] In patients with severe renal impairment, remoxipride reaches a C<sub>max</sub> of 9.3 ± 2.3 µmol/L, with a T<sub>max</sub> of 1.4 ± 0.9 h, and an AUC of 123 ± 60 µmol\*h/L.[A215502]",Remoxipride is rapidly absorbed after oral administration with a bioavailability of 90%.[A215072] Remoxipride reaches a C<sub>max</sub> of 4.1mg/L with a T<sub>max</sub> of 0.5h.[A215072],Remoxipride is a dopamine D2 receptor antagonist. It is used in the treatment of schizophrenia. It is a potent dopamine D2 receptor antagonist. It is also a potent dopamine D3 receptor antagonist. It is also a potent dopamine D4 receptor antagonist. It is also a potent dopamine D5 receptor antagonist. It is also a potent dopamine D6 receptor antagonist. It is also a potent dopamine D7 receptor antagonist. It is also a potent dopamine D8 receptor antagonist. It is also a potent dopamine D9 receptor antagonist. It is also a potent dopamine D10 receptor antagonist. It is also a potent dopamine D11 receptor,0.07659574468085105,0.009769573576500816,0,0.27710843373493976,0.00959407747904833,0
What is the absorption process of Sennosides?,<10% is absorbed from the gut mostly in the form of the active metabolite rheinanthrone [DB13175][L771].,"Sennosides A and B are the main active ingredients of senna [L772]. They are rapidly absorbed from the gastrointestinal tract and reach a maximum plasma concentration within 2.5 hours [A33022]. The hydrolysis of sennosides A and B occurs mainly in the cecum and colon where they are converted to sennidins A and B, respectively [A33022]. Sennidins A and B are then absorbed and transported to the liver via the portal vein where they are further metabolized [A33022].",The absorption process of Sennosides is the process of absorbing the active ingredients of the drug into the blood stream. The active ingredients of the drug are the active ingredients that are responsible for the drug's therapeutic effect. The absorption process of Sennosides is the process of absorbing the active ingredients of the drug into the blood stream. The active ingredients of the drug are the active ingredients that are responsible for the drug's therapeutic effect. The absorption process of Sennosides is the process of absorbing the active ingredients of the drug into the blood stream. The active ingredients of the drug are the active ingredients that are responsible for the drug,0.10687022900763359,0.009729705478061765,0,0.12631578947368421,0.02380241791084471,0
What happens during the metabolism of Remoxipride?,"Remoxipride can be N-dealkylated to FLA 853, oxidized to FLA 850, or N-deethylated to FLA 838.[A215417,A215502] FLA 838 can be oxidized to NCL 118 which is further hydroxylated to NCM 009.[A215417,A215502] FLA 850 can be N-deethylated to NCL 118 or hydroxylated to NCM 001.[A215417,A215502] NCM 001 is further N-deethylated to NCM 009.[A215417,A215502] None of these metabolites have measurable activity on dopamine D<sub>2</sub> receptors.[A215502]","Remoxipride is metabolized to two inactive metabolites, desmethyl remoxipride and hydroxymethyl remoxipride, by CYP1A2, CYP2D6, and CYP3A4.[A215721,A215726,A215731,L31838]",Remoxipride is a drug that is used to treat schizophrenia. It is a dopamine antagonist that works by blocking the effects of dopamine in the brain. Remoxipride is metabolized by the liver and excreted in the urine. The metabolism of Remoxipride is a complex process that involves several enzymes. The first step in the metabolism of Remoxipride is the hydrolysis of the ester group. This is followed by the oxidation of the alcohol group to form an aldehyde. The aldehyde is then further oxidized to form a carboxylic acid. The carboxylic acid is then,0.09248554913294797,0.010897276076343347,0,0.08,0.0013133196783210591,0
How is Enalaprilat metabolized?,Both enalapril and enalaprilat undergo renal excretion without further metabolism.,Enalaprilat is not metabolized and is excreted unchanged.,The most common side effect of Enalaprilat is hypotension.,0.10526315789473685,0.0,0,0.22222222222222224,0.0222734042410851,0
In what way is Chlorpromazine metabolized?,"Extensively metabolized in the liver and kidneys. It is extensively metabolized by cytochrome P450 isozymes CYP2D6 (major pathway), CYP1A2 and CYP3A4. Approximately 10 to 12 major metabolite have been identified. Hydroxylation at positions 3 and 7 of the phenothiazine nucleus and the N-dimethylaminopropyl side chain undergoes demethylation and is also metabolized to an N-oxide. In urine, 20% of chlopromazine and its metabolites are excreted unconjugated in the urine as unchanged drug, demonomethylchlorpromazine, dedimethylchlorpromazine, their sulfoxide metabolites, and chlorpromazine-N-oxide. The remaining 80% consists of conjugated metabolites, principally O-glucuronides and small amounts of ethereal sulfates of the mono- and dihydroxy-derivatives of chlorpromazine and their sulfoxide metabolites. The major metabolites are the monoglucuronide of N-dedimethylchlorpromazine and 7-hydroxychlorpromazine. Approximately 37% of the administered dose of chlorpromazine is excreted in urine.",Hepatic.,Chlorpromazine is metabolized by the liver.,0.05714285714285715,2.381946977696758e-10,0,0.0,0.0,0
Describe the absorption characteristics of Deutetrabenazine.,"The extent of absorption is 80% with oral deutetrabenazine. As deutetrabenazine is extensively metabolized to its main active metabolites following administration, linear dose dependence of peak plasma concentrations (Cmax) and AUC was observed for the metabolites after single or multiple doses of deutetrabenazine (6 mg to 24 mg and 7.5 mg twice daily to 22.5 mg twice daily) [FDA Label]. Cmax of deuterated α-HTBZ and β-HTBZ are reached within 3-4 hours post-dosing [FDA Label]. Food may increase the Cmax of α-HTBZ or β-HTBZ by approximately 50%, but is unlikely to have an effect on the AUC [FDA Label].","The absolute bioavailability of deuterated tetrabenazine (deutetrabenazine) is 75% after oral administration. The C<sub>max</sub> of deutetrabenazine is 6.0 ng/mL and the AUC is 72.4 ng x h/mL following oral administration of 45 mg of deutetrabenazine once daily. The T<sub>max</sub> of deutetrabenazine is 1.5 hours. The C<sub>max</sub> of the active metabolites, α-HTBZ and β-HTBZ, are 2.2 and",Deutetrabenazine is a dopamine depleting agent that is used to treat Huntington's disease. It is a dopamine depleting agent that is used to treat Huntington's disease. It is a dopamine depleting agent that is used to treat Huntington's disease. It is a dopamine depleting agent that is used to treat Huntington's disease. It is a dopamine depleting agent that is used to treat Huntington's disease. It is a dopamine depleting agent that is used to treat Huntington's disease. It is a dopamine depleting agent that is used to treat Huntington's disease. It is a dopamine de,0.06829268292682926,0.005566559772825405,0,0.20809248554913296,0.015464859243305576,0
Can you explain how Gemeprost is metabolized in the body?,"After intravenous administration, gemeprost is rapidly metabolized via hydrolysis to the free acid with half life of 10-15 minutes. The free acid is then inactivated by β- and ω-oxidation [A19726].","Gemeprost is rapidly deacetylated to the active compound 16,16-dimethyl-trans-delta<sub>2</sub>-PG (d-MTDP). This compound is further metabolized to other prostaglandins, primarily 16,16-dimethyl-15-keto-13,14-dienic acid (d-MKDP), which has little or no activity on uterine smooth muscle.",Gemeprost is metabolized in the body by the liver. It is broken down into inactive metabolites that are excreted in the urine.,0.23076923076923075,0.012517484794846916,0,0.17721518987341772,0.0314169854934702,0
How does the body process Fluticasone metabolically?,"[DB08906] and [DB00588] are cleared from hepatic metabolism by cytochrome P450 3A4[F4361,F4364,F4358,A177121][FDA Label]. Both are hydrolysed at the FIVE-S-fluoromethyl carbothioate group, forming an inactive metabolite[F4361,F4355,A177118][FDA Label].","Fluticasone propionate is cleared from hepatic metabolism by cytochrome P450 3A4[FDA Label][F4364,A177121]. Fluticasone furoate is cleared from hepatic metabolism by cytochrome P450 3A4[A177121].",Fluticasone is metabolized by the liver and excreted in the urine.,0.125,0.007269079725633151,0,0.3125,0.22007604026278207,0
Describe the absorption characteristics of Mipomersen.,The maximum mipomersen concentration is reached in about 3-4 hours after subcutaneous injection. Additionally the bioavailability of mipomersn is dose-dependant and ranges from 54%-78%.,Mipomersn is administered subcutaneously and is slowly absorbed. The Cmax was found to be 0.5 ng/ml and the Tmax was found to be 3-4 days.,"Mipomersen is a small molecule that inhibits the production of apolipoprotein B (apoB), which is a protein that is required for the production of LDL cholesterol. Mipomersen is a small molecule that inhibits the production of apolipoprotein B (apoB), which is a protein that is required for the production of LDL cholesterol. Mipomersen is a small molecule that inhibits the production of apolipoprotein B (apoB), which is a protein that is required for the production of LDL cholesterol. Mipomersen is a small molecule that inhibits the production of apolipop",0.10344827586206896,0.005270547400136668,0,0.14545454545454545,0.016942131231608527,0
Describe the absorption characteristics of Canakinumab.,The absolute bioavailability of subcutaneous canakinumab is estimated to be 70%.,The absolute bioavailability of subcutaneous canakinumab is estimated to be approximately 80%.,Canakinumab is a human monoclonal antibody that binds to IL-1β and blocks its interaction with the IL-1 receptor. It,0.18749999999999997,0.01618408566040857,0,0.8695652173913043,0.8070557274927982,0
Describe the metabolic pathway of Sotagliflozin.,"The major metabolite of sotagliflozin is a 3-O-glucuronide (M19), which comprised ~94% of of the radioactivity in plasma following the oral administration of a radiolabeled dose of sotagliflozin.[L39705] The M19 metabolite is effectively inactive, with >275-fold less activity at SGLT1 and SGLT2 compared to the parent drug.[L39725] The primary route of metabolism is via glucuronidation by UGT1A9 (and both UGT1A1 and UGT2B7, to a lesser extent) as well as oxidation via CYP3A4.[L39705]","Sotagliflozin is primarily metabolized by O-glucuronidation. The major metabolite, M5 (a 1-O-β-glucuronide of sotagliflozin), is considered inactive. Sotagliflozin is also metabolized to a minor extent by CYP3A4.[L39705]","Sotagliflozin is a sodium-glucose cotransporter 2 inhibitor. It inhibits the reabsorption of glucose in the kidneys, which increases the excretion of glucose in the urine. This leads to a decrease in blood glucose levels.",0.17699115044247787,0.010889236852154876,0,0.29357798165137616,0.007568967257120607,0
Describe the metabolic pathway of Danazol.,"Hepatic, to principal metabolites, ethisterone and 17-hydroxymethylethisterone.",Hepatic.,"Danazol is a synthetic steroid that is used to treat endometriosis and other gynecological disorders. It is a derivative of ethisterone, a synthetic progestin. Danazol is a potent inhibitor of the enzyme 17β-hydroxysteroid dehydrogenase, which is responsible for the conversion of androgens to estrogens. This inhibition results in decreased levels of circulating estrogens, which in turn leads to decreased levels of circulating androgens. The decreased levels of circulating androgens lead to decreased levels of circulating estrogens, which in turn leads to decreased levels of circulating",0.06382978723404255,0.0046086012174188324,0,0.2222222222222222,0.0,0
How does the body process Debrisoquine metabolically?,Hepatic.,Hepatic,"Debrisoquine is metabolized by the body by the enzyme CYP2D6. This enzyme is responsible for the metabolism of many drugs, including antidepressants, antipsychotics, and painkillers. The enzyme is also responsible for the metabolism of many other drugs, including some that are used to treat cancer. The enzyme is also responsible for the metabolism of some drugs that are used to treat depression and anxiety. The enzyme is also responsible for the metabolism of some drugs that are used to treat pain. The enzyme is also responsible for the metabolism of some drugs that are used to treat cancer. The enzyme is also responsible for",0.0,0.0,0,1.0,0.0,0
"Tell me about Ebola Zaire vaccine (live, attenuated)'s metabolism mechanism.","As with other live attenuated vaccines, Ebola virus vaccine is speculated to undergo nonspecific cellular degradation.","As with other live attenuated vaccines, Ebola virus vaccine is speculated to undergo nonspecific cellular degradation.","Ebola Zaire vaccine (live, attenuated) is a live, attenuated vaccine that is administered by intramuscular injection. The vaccine contains a weakened strain of the Ebola virus that has been genetically modified to be unable to cause disease in humans. When administered, the vaccine stimulates the immune system to produce antibodies against the Ebola virus, providing protection against future infection. The vaccine is effective in preventing Ebola virus disease, but it is not a cure for the disease.",0.15053763440860213,0.013663868349968994,0,1.0,1.0,1
In what way is Fomivirsen absorbed?,"Following intravitreal injection in rabbits and monkeys, peak concentrations in the vitreous was detectable immediately after injection with the concentrations increasing in a dose-proportional manner [L1428]. Due to low doses of intravitreal administration with slow disposition from the eye, there is limited absorption of the drug into the systemic circulation [A31988]. Fomivirsen is detectable in retina of rabbits within hours following administration and concentrations increase over 3 to 5 days. The concentrations of the drug were highest in the retina and iris [FDA Label].","Following intravitreal injection in rabbits, fomivirsen is absorbed into the eye and the peak concentration is reached immediately after injection. The concentration of fomivirsen in retina and vitreous is higher than that in the iris.",Fomivirsen is absorbed by,0.0449438202247191,3.467250982241831e-10,0,0.35,0.03153332920216011,0
Can you explain how Triamterene is absorbed in the body?,"Triamterene is shown to be rapidly absorbed in the gastrointestinal tract [L6166,T28] Its onset of action achiveved within 2 to 4 hours after oral ingestion [L6166] and its duration of action is 12-16 hours.[T28] It is reported that the diuretic effect of triamterene may not be observed for several days after administration.[L6166] In a pharmacokinetic study, the oral bioavailability of triamterene was determined to be 52%.[A178012] Following administration of a single oral dose to fasted healthy male volunteers, the mean AUC of triamterene was about 148.7 ng*hr/mL [L6169] and the mean peak plasma concentrations (Cmax) were 46.4 ng/mL reached at 1.1 hour after administration.[L6169] In a limited study, administration of triamterene in combination with hydrochlorothiazide resulted in an increased bioavailability of triamterene by about 67% and a delay of up to 2 hours in the absorption of the drug.[L6169] It is advised that triamterene is administered after meals; in a limited study, combination use of triamterene and hydrochlorothiazide with the consumption of a high-fat meal resulted in an increase in the mean bioavailability and peak serum concentrations of triamterene and its active sulfate metabolite, as well as a delay of up to 2 hours in the absorption of the active constituents.[L6169]",Triamterene is 50-70% absorbed from the gastrointestinal tract.[A179464] The diuretic activity of triamterene becomes apparent 3-4 hours after oral administration and lasts for 24 hours.[A179478],Triamterene is absorbed in the body by the oral route. It is a weak acid and is therefore absorbed in the stomach. It is then transported to the liver where it is metabolized by the liver enzymes. The metabolites are then excreted,0.13953488372093023,0.0015260729715094914,0,0.13061224489795917,8.131898914288255e-05,0
What is the absorption of Cabazitaxel like?,"After an intravenous dose of cabazitaxel 25 mg/m2 every three weeks to a population of 170 patients with solid tumors, the mean Cmax in patients with metastatic prostate cancer was 226 ng/mL (CV 107%) and was reached at the end of the one-hour infusion (Tmax). The mean AUC in patients with metastatic prostate cancer was 991 ng.h/mL (CV 34%). Administration with prednisone or prednisolone do not effect the pharmacokinetic profile of cabazitaxel.","The pharmacokinetic profile of cabazitaxel follows a 1-hour intravenous infusion. The steady-state concentrations of cabazitaxel and its active metabolite, cabazitaxel 6-hydroxyl, are reached after the first daily infusion. The steady-state AUC of cabazitaxel is 2.2-fold higher than the single AUC, with a steady-state Cmax 2.5-fold higher than the single Cmax. The pharmacokinetics of the active metabolite, cabazitaxel 6-hydroxyl, is linear and dose-dependent. The mean",,0.0,0.0,0,0.1973684210526316,0.035863019771257026,0
Describe the absorption characteristics of Betaxolol.,Absorption of an oral dose is complete. There is a small and consistent first-pass effect resulting in an absolute bioavailability of 89% &plusmn; 5% that is unaffected by the concomitant ingestion of food or alcohol.,Approximately 40% of an oral dose is absorbed. The bioavailability of betaxolol is 15-20% due to a significant first-pass effect.,Betaxolol is a non-selective beta blocker that is used to treat glaucoma. It is a beta blocker that is used to treat glaucoma. It is a beta blocker that is used to treat glaucoma. It is a beta blocker that is used to treat glaucoma. It is a beta blocker that is used to treat glaucoma. It is a beta blocker that is used to treat glaucoma. It is a beta blocker that is used to treat glaucoma. It is a beta blocker that is used to treat glaucoma. It is a beta blocker that is used to treat,0.07352941176470588,0.010397163254990268,0,0.3448275862068966,0.10645919955511406,0
How does the body absorb Cedazuridine?,"Cedazuridine (100 mg) taken orally with [decitabine] (35 mg) once daily for five days resulted in a day 1 AUC and steady-state AUC (coefficient of variation) of 103 (55%) and 178 (53%) ng\*hr/mL for [decitabine] and 2950 (49%) and 3291 (45%) ng\*hr/mL for cedazuridine, respectively. Overall, the 5-day cumulative AUC for [decitabine] was 851 (50%). Similarly, the C<sub>max</sub> for [decitabine] and cedazuridine was 145 (55%) and 371 (52%) ng/mL, respectively. The median T<sub>max</sub> for [decitabine] was 1 hr (range 0.3 to 3.0 hrs) and for cedazuridine was 3 hrs (range 1.5 to 6.1 hrs).[L14897] The bioavailability of [decitabine], as assessed by comparing the AUC of oral [decitabine] co-administered with cedazuridine to intravenous [decitabine] alone, was 60% on day 1 (90% CI of 55-65%). The corresponding values on day 5 and considering the cumulative day 5 dose were 106% (90% CI: 98, 114) and 99% (90% CI: 93, 106). Hence, the oral bioavailability of [decitabine] approaches 100% over the 5-day treatment cycle.[L14897]",Cedazuridine is not significantly absorbed after oral administration [L1203].,The body absorbs Cedazuridine by the process of passive diffusion.,0.05181347150259067,9.70906614930304e-09,0,0.020833333333333332,1.4157746821569513e-09,0
Tell me about Azlocillin's metabolism mechanism.,"Eliminated predominantly by renal mechanisms, but also undergoes biotransformation within body tissues and intraintestinal degradation by bowel bacteria, with high concentrations found in bile.",Not metabolized.,Azlocillin is a beta-lactam antibiotic that is used to treat bacterial infections. It works by inhibiting the synthesis of bacterial cell walls. Azlocillin is metabolized in the liver and excreted in the urine.,0.10344827586206896,0.011303083972869978,0,0.0,0.0,0
